,"0","946404597",,"en","8472781",,,,,,,,"2048","735655778","https://dynamic-media-cdn.tripadvisor.com/media/photo-o/2b/d9/37/62/caption.jpg","1536","2048","735655777","https://dynamic-media-cdn.tripadvisor.com/media/photo-o/2b/d9/37/61/caption.jpg","1536","1536","735655776","https://dynamic-media-cdn.tripadvisor.com/media/photo-o/2b/d9/37/60/caption.jpg","2048","2048","735655775","https://dynamic-media-cdn.tripadvisor.com/media/photo-o/2b/d9/37/5f/caption.jpg","1536","2048","735655774","https://dynamic-media-cdn.tripadvisor.com/media/photo-o/2b/d9/37/5e/caption.jpg","1536","2048","735655773","https://dynamic-media-cdn.tripadvisor.com/media/photo-o/2b/d9/37/5d/caption.jpg","1536","2048","735655772","https://dynamic-media-cdn.tripadvisor.com/media/photo-o/2b/d9/37/5c/caption.jpg","1536","2048","735655771","https://dynamic-media-cdn.tripadvisor.com/media/photo-o/2b/d9/37/5b/caption.jpg","1536","2048","735655770","https://dynamic-media-cdn.tripadvisor.com/media/photo-o/2b/d9/37/5a/caption.jpg","1536","1536","735655769","https://dynamic-media-cdn.tripadvisor.com/media/photo-o/2b/d9/37/59/caption.jpg","2048","1536","735655768","https://dynamic-media-cdn.tripadvisor.com/media/photo-o/2b/d9/37/58/caption.jpg","2048","1536","735655767","https://dynamic-media-cdn.tripadvisor.com/media/photo-o/2b/d9/37/57/caption.jpg","2048","2048","735655766","https://dynamic-media-cdn.tripadvisor.com/media/photo-o/2b/d9/37/56/caption.jpg","1536","2048","735655765","https://dynamic-media-cdn.tripadvisor.com/media/photo-o/2b/d9/37/55/caption.jpg","1536","2048","735655764","https://dynamic-media-cdn.tripadvisor.com/media/photo-o/2b/d9/37/54/caption.jpg","1536","2048","735655763","https://dynamic-media-cdn.tripadvisor.com/media/photo-o/2b/d9/37/53/caption.jpg","1536",,,,,,,,,,,,,,,,,,,,,,,,,,,,,,,,,,,,,,,,,,,,,"607/10 Colombo Road, Gintota, Galle 80000 Sri Lanka","Gintota","Sri Lanka","80000",,"607/10 Colombo Road",,"8472781","6.059465","Gintota, Galle, Galle District, Southern Province","80.1789","The Postcard Galle","184","4.8","2","0","3","15","164","https://www.tripadvisor.com/Hotel_Review-g8474349-d8472781-Reviews-The_Postcard_Galle-Gintota_Galle_Galle_District_Southern_Province.html","https://www.postcardresorts.com/hotels/the-postcard-galle","2024-04-12","MOBILE","3",,,,,,,,,,,,,,,,"We stayed at the Postcard for three nights. Theoretically, the hotel has everything it needs to be an outstanding hotel: only a handful of rooms, very kind staff throughout, a peaceful and idyllic location, beautiful colonial vibes. We loved the manager at the breakfast who also helped out at the reception. Prices inside the hotel are also fair, and the a la carte breakfast was excellent. For thus far, the hotel could be a gem, and my review could be short and positive.

Now come the big concerns, the hotel showed some big, big no-nos to us:

- Complete mayhem with our reservation beforehand (be careful!): the hotel requires a prepayment, which is of course fine. But the hotel wanted us to pay outside of Booking.com where we reserved, that is, through an internet link they sent us. After stating several times that we would prefer having the prepayment made through Booking.com (as it is done everywhere else we ever stayed), we paid through the link not to get the reservation canceled. That actually worked, we got a confirmation from the hotel by email. At the same time, a confirmation in the Booking.com chat was not given even after repeated requests. Then it became shady: we received another message from the hotel that we should use another link to register our card (once again?) despite the prepayment. Although this link looked sketchy, like a scam, and not like the previous one. Later that day, we indeed received another message from the hotel that we should not use any such link because it was „spam“. Were they hacked and someone is sending out scam links? It was really not clear what was going on, but it certainly was a horrible start. We reported this to the hotel manager, who downplayed the issue completely, saying that it was a standard „spam“ message sent out by Booking.com, although this was clearly not the case. I recommend everyone to be extremely careful with such payment links from the hotel. 
- Questionable practices with Tuktuks: Someone at the hotel seems to fight Uber and Pick me, two common and very comfortable options for ordering a cab or Tuktuk. As there is practically nothing around the hotel, you will likely need a Tuktuk to go places. The „regular“ prices one would negotiate are actually pretty high (~1500 LKR). Uber and Pick me are much cheaper (~400-500 LKR). Yet four different drivers independently told us that the hotel security would put drivers in trouble with the local Tuktuk association that wants to implement the higher prices instead. One driver said he would get beaten if the security guard noted his plate number and two of the drivers dropped us somewhere nearby so as not to be seen by security. We reported this to the hotel manager, who then spoke to his staff and a driver. The manager told us that the hotel had no such policy and basically that nothing like that could have ever happened. Again not sure what’s going on here, but the manager‘s story appears simply not credible given the four drivers reporting the same thing who have no incentive to invent this story after all. In any case, the hotel manager does not seem to care (enough). To us, this seemed like some kind of mafia thing going on, but at the minimum such practices are unprofessional and to the disadvantage of travelers like us. 
- Last but not least, we had several cockroaches in our bathroom during our stay. Although the hotel appeared very clean overall, I guess things like that may happen in countries like Sri Lanka (but also it was our only hotel here with cockroaches). The insects seemed to come through the bathroom sewage. The hotel absolutely needs to take action. We told the manager who sent someone to remove the cockroaches, and he apologized for the inconvenience, but that’s about it. 
- The second time we had cockroaches and we let him know after checkout, he did not even react anymore. The same goes for another message about a Tuktuk driver explaining the situation above. Overall, it’s seems like the manager (who was very friendly at first), does not care too much.","Could be outstanding but then…","2024-03","COUPLES","https://www.tripadvisor.com/ShowUserReviews-g8474349-d8472781-r946404597-The_Postcard_Galle-Gintota_Galle_Galle_District_Southern_Province.html",
,"0","946151676",,"en","8472781",,,,,,,,"874","735444816","https://dynamic-media-cdn.tripadvisor.com/media/photo-o/2b/d5/ff/50/caption.jpg","1179","881","735444819","https://dynamic-media-cdn.tripadvisor.com/media/photo-o/2b/d5/ff/53/caption.jpg","1179","783","735444817","https://dynamic-media-cdn.tripadvisor.com/media/photo-o/2b/d5/ff/51/caption.jpg","1179","4032","735444820","https://dynamic-media-cdn.tripadvisor.com/media/photo-o/2b/d5/ff/54/caption.jpg","3024","3581","735444822","https://dynamic-media-cdn.tripadvisor.com/media/photo-o/2b/d5/ff/56/caption.jpg","3024","4032","735444821","https://dynamic-media-cdn.tripadvisor.com/media/photo-o/2b/d5/ff/55/caption.jpg","3024","2236","735444818","https://dynamic-media-cdn.tripadvisor.com/media/photo-o/2b/d5/ff/52/caption.jpg","3470",,,,,,,,,,,,,,,,,,,,,,,,,,,,,,,,,,,,,,,,,,,,,,,,,,,,,,,,,,,,,,,,,,,,,,,,,,,,,,,,,"607/10 Colombo Road, Gintota, Galle 80000 Sri Lanka","Gintota","Sri Lanka","80000",,"607/10 Colombo Road",,"8472781","6.059465","Gintota, Galle, Galle District, Southern Province","80.1789","The Postcard Galle","184","4.8","2","0","3","15","164","https://www.tripadvisor.com/Hotel_Review-g8474349-d8472781-Reviews-The_Postcard_Galle-Gintota_Galle_Galle_District_Southern_Province.html","https://www.postcardresorts.com/hotels/the-postcard-galle","2024-04-10","OTHER","3","Not close to the beach but close to the Galle fort, maritime museum.","Value","4","Rooms","5","Location","3","Cleanliness","5","Service","5","Sleep Quality","5",,,"Mixed reviews: I had my doubts when I dealt with Karan Kumar but the property had come with high recommendations, I decided to go ahead. The positives: Mr V.P Ajith, the operations manager at Galle, a rather humble man who went out of his way to get us a celebratory Anniversary cake.  
2) friendly staff- always helpful and smiling and very pro active.
3) love the anytime breakfast concept.
4) beds super comfy!!

Negatives: the rooms was paid in full and in advance but  the evening before (as I requested to settle any outstanding dues, as I head to head out to Colombo the next morning and it was an early start), I was handed an extra lkr 50,000 bill and I was told the Sri Lankan government had increased the taxes. Until that moment 
no one had informed me either in writing or otherwise about these additional charges. I got a written confirmation on the 2nd April of payment in full received and no additional charges were due. But when I check out on the 10th April, I am given an invoice of LKR 50000 + more!!
2) location is good for Galle Fort, Maritime museum but not so good for the beaches, surfing like the Ahangama beach.
3) pool rather small and jacuzzi in the room didn’t work.
4) no fridge or hair dryer in the room.

The background of the Oberoi group does no justice to the way hospitality is being practiced or conducted in The postcard hotel. A lot of too and fro finally managed to sort out the stress.","Wonderful staff, peaceful comfy setting..","2024-04","SOLO","https://www.tripadvisor.com/ShowUserReviews-g8474349-d8472781-r946151676-The_Postcard_Galle-Gintota_Galle_Galle_District_Southern_Province.html",
,"0","993967494",,"en","17790720",,"General Manager","994741220","en","2025-02-20","Buddhika Kohana","Dear Guest,
Thank you for your feedback! We're glad you enjoyed the spacious rooms and the tea factory experience. Regarding the soundproofing, the tin sheets used for partitions are part of maintaining the authentic tea factory vibe, though they can limit soundproofing.

As for the pool, its outdoor location in the mountain range makes temperature control challenging, and we appreciate your understanding of the cooler water. We're also sorry for the room configuration issue and are working to avoid such misunderstandings in the future.

We value your feedback and are grateful for your recognition of our helpful team. We hope to welcome you back soon!

Thank you.

Regards
Buddhika Kohona","1280","786481396","https://dynamic-media-cdn.tripadvisor.com/media/photo-o/2e/e0/c0/f4/caption.jpg","960","963","786481397","https://dynamic-media-cdn.tripadvisor.com/media/photo-o/2e/e0/c0/f5/caption.jpg","1280","963","786481398","https://dynamic-media-cdn.tripadvisor.com/media/photo-o/2e/e0/c0/f6/caption.jpg","1280","963","786481399","https://dynamic-media-cdn.tripadvisor.com/media/photo-o/2e/e0/c0/f7/caption.jpg","1280","963","786481400","https://dynamic-media-cdn.tripadvisor.com/media/photo-o/2e/e0/c0/f8/caption.jpg","1280","963","786481401","https://dynamic-media-cdn.tripadvisor.com/media/photo-o/2e/e0/c0/f9/caption.jpg","1280","963","786481402","https://dynamic-media-cdn.tripadvisor.com/media/photo-o/2e/e0/c0/fa/caption.jpg","1280","2048","786481403","https://dynamic-media-cdn.tripadvisor.com/media/photo-o/2e/e0/c0/fb/caption.jpg","1536","2048","786481404","https://dynamic-media-cdn.tripadvisor.com/media/photo-o/2e/e0/c0/fc/caption.jpg","1536","1536","786481405","https://dynamic-media-cdn.tripadvisor.com/media/photo-o/2e/e0/c0/fd/caption.jpg","2048","1536","786481408","https://dynamic-media-cdn.tripadvisor.com/media/photo-o/2e/e0/c1/00/caption.jpg","2048","1536","786481409","https://dynamic-media-cdn.tripadvisor.com/media/photo-o/2e/e0/c1/01/caption.jpg","2048","2048","786481410","https://dynamic-media-cdn.tripadvisor.com/media/photo-o/2e/e0/c1/02/caption.jpg","1536","2048","786481411","https://dynamic-media-cdn.tripadvisor.com/media/photo-o/2e/e0/c1/03/caption.jpg","1536","1536","786481412","https://dynamic-media-cdn.tripadvisor.com/media/photo-o/2e/e0/c1/04/caption.jpg","2048","1536","786481413","https://dynamic-media-cdn.tripadvisor.com/media/photo-o/2e/e0/c1/05/caption.jpg","2048","1536","786481414","https://dynamic-media-cdn.tripadvisor.com/media/photo-o/2e/e0/c1/06/caption.jpg","2048","2048","786481415","https://dynamic-media-cdn.tripadvisor.com/media/photo-o/2e/e0/c1/07/caption.jpg","1536",,,,,,,,,,,,,,,,,,,,,,,,,,,,,,,,,,,,,"Kabaragalla Estate, Mandaramnuwara 20742 Sri Lanka","Mandaramnuwara","Sri Lanka","20742",,"Kabaragalla Estate",,"17790720","7.058889","Mandaramnuwara, Central Province","80.75643","Tea and Experience Factory - Thema Collection","255","4.8","3","2","7","23","220","https://www.tripadvisor.com/Hotel_Review-g18207106-d17790720-Reviews-Tea_and_Experience_Factory_Thema_Collection-Mandaramnuwara_Central_Province.html","https://www.themacollection.com/tea-and-experience-factory/","2025-02-14","MOBILE","3",,,,,,,,,,,,,,,,"We had a fairly decent stay at the hotel. Rooms are spacious and have a whole different vibe to match the tea factory experience. Rooms are not sound proof which is a downside. With the 30% off local residents offer , you can’t expect much variation in food items. All three meals were set menu and overall very normal, cant complain too much against the cost, but could have been better.
Pool is not heated, so bit uncomfortable until you get used to the cold water. There was a field visit sort of experience where you can experience the whole tea making process.
Need to mention that the reservation and management was helpful with amendments to my booking because I’ve accidentally booked for March instead of February. However our whole stay got complicated by the false advertising about having 2 double beds in Periya Dorei Family room, because the hotel allocated a single double bed and 2 single beds, which is very disappointing as they were unable to accommodate what has been advertised.","Fair stay at Mandaram Nuwara","2025-02","FAMILY","https://www.tripadvisor.com/ShowUserReviews-g18207106-d17790720-r993967494-Tea_and_Experience_Factory_Thema_Collection-Mandaramnuwara_Central_Province.html",
,"0","968634209",,"en","17790720",,"General Manager","968786560","en","2024-09-07","Buddhika Kohona","Dear Guest,

Thank you for taking the time to share your thoughts with us. We’re pleased to hear you enjoyed our location, friendly staff, and the food.

We understand your concerns regarding the room’s soundproofing and the size of the shower cubicle. Our unique design, which incorporates tin sheets to maintain an authentic tea factory experience, does affect sound insulation. We appreciate your feedback and will consider it as we look for ways to improve our guest experience while preserving the charm of our setting.

We’re sorry to hear that the fresh fish balls didn’t meet your expectations. Your feedback is invaluable as we strive to enhance our offerings.

Thank you again for your comments, and we hope to have the opportunity to welcome you back in the future.

Regards

Buddhika Kohona",,,,,,,,,,,,,,,,,,,,,,,,,,,,,,,,,,,,,,,,,,,,,,,,,,,,,,,,,,,,,,,,,,,,,,,,,,,,,,,,,,,,,,,,,,,,,,,,,,,,,,,,,,,,,"Kabaragalla Estate, Mandaramnuwara 20742 Sri Lanka","Mandaramnuwara","Sri Lanka","20742",,"Kabaragalla Estate",,"17790720","7.058889","Mandaramnuwara, Central Province","80.75643","Tea and Experience Factory - Thema Collection","255","4.8","3","2","7","23","220","https://www.tripadvisor.com/Hotel_Review-g18207106-d17790720-Reviews-Tea_and_Experience_Factory_Thema_Collection-Mandaramnuwara_Central_Province.html","https://www.themacollection.com/tea-and-experience-factory/","2024-09-06","OTHER","3","Walls are made out of very thin sheets (1cm thickness). Not recommended if you are going to have personal chats, everything is audible.","Value","2","Rooms","1","Location","4","Cleanliness","5","Service","3","Sleep Quality","4",,,"Hotel location was good. Staff was friendly and helpful. Rooms are large enough but the shower cubical was too small. The walls of the rooms are built from very cheep materials ( asbestos sheet & Metal sheets) . You can hear conversations clearly from other rooms. At midnight you can hear sounds even from 4 rooms away. Will never recommend this to a honeymoon couple or a couple who is ready to have private conversations with in their room. Food was good, but their fresh fish balls are like dry fish balls.","Spacious room without soundproof walls","2024-09","FRIENDS","https://www.tripadvisor.com/ShowUserReviews-g18207106-d17790720-r968634209-Tea_and_Experience_Factory_Thema_Collection-Mandaramnuwara_Central_Province.html",
,"0","895211497",,"en","17790720",,"General Manager","895842660","en","2023-06-19","Buddhika Kohona","Dear Shalitha Herath,

I would like to personally express my gratitude for taking the time to provide feedback about your recent stay at our hotel. We truly appreciate your kind words regarding our breathtaking view, serene environment, friendly staff, and delectable cuisine. Our team is dedicated to creating a relaxing and enjoyable experience for all our guests, and it is delightful to hear that your overall experience was so positive.

However, I am deeply sorry to hear about the unfortunate incident that occurred at our spa. Please accept our sincerest apologies for any discomfort experienced by your family member. We take such matters very seriously, and as soon as we were made aware of the situation, my self and our Custer HR Manager initiated an internal investigation.

I want to assure you that this type of behavior is completely unacceptable and runs counter to our core values as a company. Our management team promptly launched an internal investigation upon receiving your complaint. We have meticulously reviewed the details, and it is important to note that the therapist involved has had a long-standing tenure with us, and we have not received any prior complaints about their conduct. However, rest assured that appropriate measures will be taken once the investigation is concluded.

Once again, I extend my sincere apologies for the discomfort caused, and I appreciate your understanding in this matter. We value your recommendation of our hotel and hope to have the opportunity to provide you with the exceptional experience you deserve on your next visit.

If you have any further questions or require additional assistance, please do not hesitate to reach out to me . We are here to ensure your satisfaction.

Tea and Experience Factory
Resort Manager ",,,,,,,,,,,,,,,,,,,,,,,,,,,,,,,,,,,,,,,,,,,,,,,,,,,,,,,,,,,,,,,,,,,,,,,,,,,,,,,,,,,,,,,,,,,,,,,,,,,,,,,,,,,,,"Kabaragalla Estate, Mandaramnuwara 20742 Sri Lanka","Mandaramnuwara","Sri Lanka","20742",,"Kabaragalla Estate",,"17790720","7.058889","Mandaramnuwara, Central Province","80.75643","Tea and Experience Factory - Thema Collection","255","4.8","3","2","7","23","220","https://www.tripadvisor.com/Hotel_Review-g18207106-d17790720-Reviews-Tea_and_Experience_Factory_Thema_Collection-Mandaramnuwara_Central_Province.html","https://www.themacollection.com/tea-and-experience-factory/","2023-06-15","OTHER","3",,,,,,,,,,,,,,,,"The property had one of the best scenic views I have experienced and the food and staff service from front office and restaurants were superb. The leaf to cup experience was a first-time experience and the guide did an excellent job in explaining the entire process. Due to the time restrictions we had to skip the waterfall trekking. This whole trip would have been a memorable one but due to the perverted actions of the spa therapist our entire trip was ruined. The spa therapist had tried to sexually harass my younger sister when she went in for a head massage. Although we had handed the manager a written statement of this disgusting event, we have not yet received any response from them regarding the action they have taken against this employee (Asanka). For any guest who is planning to visit this property, please refrain from visiting the spa.","Bad experience at Tea and Experience Factory","2023-06","FAMILY","https://www.tripadvisor.com/ShowUserReviews-g18207106-d17790720-r895211497-Tea_and_Experience_Factory_Thema_Collection-Mandaramnuwara_Central_Province.html",
,"0","865624607",,"en","17790720",,,,,,,,,,,,,,,,,,,,,,,,,,,,,,,,,,,,,,,,,,,,,,,,,,,,,,,,,,,,,,,,,,,,,,,,,,,,,,,,,,,,,,,,,,,,,,,,,,,,,,,,,,,,,,,,,,,,"Kabaragalla Estate, Mandaramnuwara 20742 Sri Lanka","Mandaramnuwara","Sri Lanka","20742",,"Kabaragalla Estate",,"17790720","7.058889","Mandaramnuwara, Central Province","80.75643","Tea and Experience Factory - Thema Collection","255","4.8","3","2","7","23","220","https://www.tripadvisor.com/Hotel_Review-g18207106-d17790720-Reviews-Tea_and_Experience_Factory_Thema_Collection-Mandaramnuwara_Central_Province.html","https://www.themacollection.com/tea-and-experience-factory/","2022-10-23","OTHER","3",,"Rooms","5","Cleanliness","5","Service","5",,,,,,,,,"Tea & Experience Factory offers a great getaway in the middle of the hills. The renovated tea factory gets you up close and personal with Sri Lanka's famed tea industry and its past. The rooms are neatly renovated to demonstrate this past while the factory tour provides a unique insight into the tea-making process. The food is delectable and richly made. The culinary team at this hotel deserve a special award.","An amazing hideaway in the mountains","2022-10","NONE","https://www.tripadvisor.com/ShowUserReviews-g18207106-d17790720-r865624607-Tea_and_Experience_Factory_Thema_Collection-Mandaramnuwara_Central_Province.html",
,"1","830118485",,"en","17790720",,,,,,,,,,,,,,,,,,,,,,,,,,,,,,,,,,,,,,,,,,,,,,,,,,,,,,,,,,,,,,,,,,,,,,,,,,,,,,,,,,,,,,,,,,,,,,,,,,,,,,,,,,,,,,,,,,,,"Kabaragalla Estate, Mandaramnuwara 20742 Sri Lanka","Mandaramnuwara","Sri Lanka","20742",,"Kabaragalla Estate",,"17790720","7.058889","Mandaramnuwara, Central Province","80.75643","Tea and Experience Factory - Thema Collection","255","4.8","3","2","7","23","220","https://www.tripadvisor.com/Hotel_Review-g18207106-d17790720-Reviews-Tea_and_Experience_Factory_Thema_Collection-Mandaramnuwara_Central_Province.html","https://www.themacollection.com/tea-and-experience-factory/","2022-03-04","MOBILE","3",,,,,,,,,,,,,,,,"The concept of tea and factory experience didn’t live up to the hype. I felt the overall attempt at the concept was a tad below par.

SriLankaN food was good western items need improvement 

Rooms and toilets very comfortable clean and spacious but sound proofing we felt was an issue.","Friends visited","2022-03","FRIENDS","https://www.tripadvisor.com/ShowUserReviews-g18207106-d17790720-r830118485-Tea_and_Experience_Factory_Thema_Collection-Mandaramnuwara_Central_Province.html",
,"3","827025449",,"en","17790720",,,,,,,,,,,,,,,,,,,,,,,,,,,,,,,,,,,,,,,,,,,,,,,,,,,,,,,,,,,,,,,,,,,,,,,,,,,,,,,,,,,,,,,,,,,,,,,,,,,,,,,,,,,,,,,,,,,,"Kabaragalla Estate, Mandaramnuwara 20742 Sri Lanka","Mandaramnuwara","Sri Lanka","20742",,"Kabaragalla Estate",,"17790720","7.058889","Mandaramnuwara, Central Province","80.75643","Tea and Experience Factory - Thema Collection","255","4.8","3","2","7","23","220","https://www.tripadvisor.com/Hotel_Review-g18207106-d17790720-Reviews-Tea_and_Experience_Factory_Thema_Collection-Mandaramnuwara_Central_Province.html","https://www.themacollection.com/tea-and-experience-factory/","2022-02-06","MOBILE","3",,,,,,,,,,,,,,,,"The staff were the only good thing about this hotel. Chathuranga, Viran and Rajitha are the only reason I gave the hotel 3 stars and not 1 star. Their service was outstanding- some of the best I’ve had in the country. Chathuranga accompanied us to a beautiful waterfall which was the highlight of the trip. Viran and Rajitha who were at the restaurant knew what we needed even before we asked. 

The hotel and amenities were however severely lacking. There was no soundproofing at all between the rooms and you could even hear conversations happening in adjoining rooms. While they did warn us about the lack of soundproofing, the reality was much worse than we anticipated. We were woken up at 6am on both days by snoring, running children and a plethora of other noises. 

I would strongly advise against booking this hotel if you are travelling with a group as there is no common area to relax or hang out. Because of COVID, we couldn’t use the indoor bar area. On our last night we were allowed to use the indoor tea machine area however the night before that, we had to make do with sitting outside in the cold. We couldn’t even use a room because we would disturb the other guests upstairs because of the lack of soundproofing. 

All in all, not a great experience.","The staff were the only good thing about this hotel","2022-02","FRIENDS","https://www.tripadvisor.com/ShowUserReviews-g18207106-d17790720-r827025449-Tea_and_Experience_Factory_Thema_Collection-Mandaramnuwara_Central_Province.html",
"No reviews found for the provided location. Check whether the location has any reviews.",,,"https://www.tripadvisor.com/Hotel_Review-g3577009-d27940388-Reviews-Waraka_Udawalawe_Thema_Collection-Udawalawa_Sabaragamuwa_Province.html",,,,,,,,,,,,,,,,,,,,,,,,,,,,,,,,,,,,,,,,,,,,,,,,,,,,,,,,,,,,,,,,,,,,,,,,,,,,,,,,,,,,,,,,,,,,,,,,,,,,,,,,,,,,,,,,,,,,,,"224/B, Susil Mawatha, South Cannel, Udawalawe, Udawalawa 70190 Sri Lanka","Udawalawa","Sri Lanka","70190",,"224/B, Susil Mawatha, South Cannel, Udawalawe",,"27940388","6.406758","Udawalawa, Sabaragamuwa Province","80.830444","Waraka, Udawalawe - Thema Collection","74","4.9","0","0","0","10","64","https://www.tripadvisor.com/Hotel_Review-g3577009-d27940388-Reviews-Waraka_Udawalawe_Thema_Collection-Udawalawa_Sabaragamuwa_Province.html","https://www.themacollection.com/waraka-udawalawe/",,,,,,,,,,,,,,,,,,,,,,,,
