,"1","984631075",,"en","2038179",,"Marketing","985102648","en","2024-12-16","Noel Amath","Dear Athula,

Thank you sincerely for your kind review! We are delighted you enjoyed your stay with us.

We also thank you for your candid review and appreciate your comments as feedback from our valued guests is the best way for us to improve our product.

Do feel free to visit us again, and please try our buffets for Breakfast, Lunch, and Dinner at the Verandah. You may also want to drop by our other restaurants including 1864, Fire Beach, and Traveler's Bar for a dining experience in true GFH style.

Stay tuned also for a Cuban treat in December! our King of The Mambo restaurant is undergoing a renovation and will be re-opening in December!

Looking forward to your next visit!

Thank You

Noel - GFH",,,,,,,,,,,,,,,,,,,,,,,,,,,,,,,,,,,,,,,,,,,,,,,,,,,,,,,,,,,,,,,,,,,,,,,,,,,,,,,,,,,,,,,,,,,,,,,,,,,,,,,,,,,,,"3,2 Galle Road, Colombo 00300 Sri Lanka","Colombo","Sri Lanka","00300",,"3,2 Galle Road",,"2038179","6.920018","Colombo, Western Province","79.84597","Galle Face Hotel","4348","4.5","105","121","239","881","3002","https://www.tripadvisor.com/Hotel_Review-g293962-d2038179-Reviews-Galle_Face_Hotel-Colombo_Western_Province.html","http://www.gallefacehotel.com/","2024-12-12","OTHER","3",,"Value","2","Rooms","2","Location","4","Cleanliness","3","Service","3","Sleep Quality","5",,,"The Queen bed was exceptionally comfortable, and the pillows were soft and inviting. However, the room itself was small, with furnishings that felt outdated and reminiscent of an antique style. It appeared as though the room hadn't been renovated in generations, and it’s in dire need of serious remodeling to meet modern standards. Considering the nightly rate—which exceeds those of more contemporary hotels in Colombo—the pricing felt unjustified. It seems the hotel's primary appeal lies in its historical charm. On a positive note, the breakfast buffet, included in the room rate, was excellent, offering an extensive selection of dishes to cater to a wide range of preferences.","Galle Face Hotel, Colombo Stay","2024-12","COUPLES","https://www.tripadvisor.com/ShowUserReviews-g293962-d2038179-r984631075-Galle_Face_Hotel-Colombo_Western_Province.html",
,"1","983552981",,"en","2038179",,"Marketing","988044465","en","2025-01-07","Noel Amath","Dear Valued Guest,

Thank you for your candid review, we sincerely appreciate your feedback and are keen to rectify the issues mentioned.

Also please do accept out sincerest assurances that all the issue you mentioned in your review are being looked into very seriously and immediate corrective action will be taken without fail.

We would also like to humbly invite you back to our hotel, so you can see first hand the corrective action taken as well as to give us the opportunity to  provide you with the true GFH experience, you should have been provided during your stay with us.

Thank You and Best Regards

Noel - Galle Face Hotel
","2048","776698664","https://dynamic-media-cdn.tripadvisor.com/media/photo-o/2e/4b/7b/28/caption.jpg","1536","2048","776698663","https://dynamic-media-cdn.tripadvisor.com/media/photo-o/2e/4b/7b/27/caption.jpg","1536","2048","776698662","https://dynamic-media-cdn.tripadvisor.com/media/photo-o/2e/4b/7b/26/caption.jpg","1536","2048","776698661","https://dynamic-media-cdn.tripadvisor.com/media/photo-o/2e/4b/7b/25/caption.jpg","1536","2048","776698660","https://dynamic-media-cdn.tripadvisor.com/media/photo-o/2e/4b/7b/24/caption.jpg","1536",,,,,,,,,,,,,,,,,,,,,,,,,,,,,,,,,,,,,,,,,,,,,,,,,,,,,,,,,,,,,,,,,,,,,,,,,,,,,,,,,,,,,,,,,"3,2 Galle Road, Colombo 00300 Sri Lanka","Colombo","Sri Lanka","00300",,"3,2 Galle Road",,"2038179","6.920018","Colombo, Western Province","79.84597","Galle Face Hotel","4348","4.5","105","121","239","881","3002","https://www.tripadvisor.com/Hotel_Review-g293962-d2038179-Reviews-Galle_Face_Hotel-Colombo_Western_Province.html","http://www.gallefacehotel.com/","2024-12-07","MOBILE","3","Don’t be happy about an upgrade. Do t stay in room 1008. The windows no double glazing and the bed is towards a dirty window",,,,,,,,,,,,,,,"From the outside the hotel looks beautiful. Security is top notch . Then we received an upgrade which normally is wonderful. Well, if this was an upgrade I wonder what the normal room would have been like. We had  an early start, no roomservice available before 8am. They did provide a bag with sandwich banana and coconut water for on the road. 
The room was facing the ocean , no double glazing, bar of the beach plays loud disco music until midnight. The phone in the room has no directions of how to call reception.","Old style emphasizing old","2024-12","COUPLES","https://www.tripadvisor.com/ShowUserReviews-g293962-d2038179-r983552981-Galle_Face_Hotel-Colombo_Western_Province.html",
,"0","980548106",,"nl","2038179",,,,,,,,,,,,,,,,,,,,,,,,,,,,,,,,,,,,,,,,,,,,,,,,,,,,,,,,,,,,,,,,,,,,,,,,,,,,,,,,,,,,,,,,,,,,,,,,,,,,,,,,,,,,,,,,,,,,"3,2 Galle Road, Colombo 00300 Sri Lanka","Colombo","Sri Lanka","00300",,"3,2 Galle Road",,"2038179","6.920018","Colombo, Western Province","79.84597","Galle Face Hotel","4348","4.5","105","121","239","881","3002","https://www.tripadvisor.com/Hotel_Review-g293962-d2038179-Reviews-Galle_Face_Hotel-Colombo_Western_Province.html","http://www.gallefacehotel.com/","2024-11-15","MOBILE","3","Er zijn mooiere hotels voor minder geld",,,,,,,,,,,,,,,"Van de 6 hotels die we itijdens onze rondreis in Sri Lanka bezocht hebben. heeft Galle Face Hotel de minste prijs kwaliteit verhouding. Zeker dubbel zo duur als de andere bij. en de minste kamer.  Deze keer geen balkon en uitzicht op een hoog buur gebouw en de bouwplaats van het hotel.
Betalen met creditcard diende vooraf te gebeuren (direct betaald,  geen restvering). Bij vertrek was er LkR 28000 te veel betaald,  wat op de credit card terug gestort zou worden.  Het is nu 6 weken later,  msec nog steeds niet gebeurd. Diverse keren mail contact gehad en toezegging gekregen dat het opgelost zou worden,  maar helaas.   Op mail wordt intussen niet meer gereageerd.
Hier ga ik niet meer heen.","Niet voor herhaling vatbaar: vergane glorie!","2024-11","FRIENDS","https://www.tripadvisor.com/ShowUserReviews-g293962-d2038179-r980548106-Galle_Face_Hotel-Colombo_Western_Province.html",
,"1","977727728",,"en","2038179",,"Marketing","978280340","en","2024-11-01","Noel Amath","Dear Valued Guest,

Thank you for your kind review, we are thrilled you enjoyed your stay with us.

Do please reach out to us at noel.amath@gallefacehotel.com when planning your next visit to Sri Lanka and we will be delighted to recommend a quieter room for you and make all arrangements to ensure your next stay with us is a memorable one.

Thank You and Best Regards
Noel - GFH",,,,,,,,,,,,,,,,,,,,,,,,,,,,,,,,,,,,,,,,,,,,,,,,,,,,,,,,,,,,,,,,,,,,,,,,,,,,,,,,,,,,,,,,,,,,,,,,,,,,,,,,,,,,,"3,2 Galle Road, Colombo 00300 Sri Lanka","Colombo","Sri Lanka","00300",,"3,2 Galle Road",,"2038179","6.920018","Colombo, Western Province","79.84597","Galle Face Hotel","4348","4.5","105","121","239","881","3002","https://www.tripadvisor.com/Hotel_Review-g293962-d2038179-Reviews-Galle_Face_Hotel-Colombo_Western_Province.html","http://www.gallefacehotel.com/","2024-10-30","MOBILE","3",,,,,,,,,,,,,,,,"This is a real heritage hotel but also a bit dated. We choose this hotel for our first night’s stay after arriving in Sri Lanka. The room was facing the road and it was quite noisy and everything is a bit tired. However the atmosphere of the place was great. Fantastic breakfast on a terrace overlooking the garden and the sea. As it was just for one night we didn’t regret our choice.","A bit of faded glory but worth visit","2024-10","COUPLES","https://www.tripadvisor.com/ShowUserReviews-g293962-d2038179-r977727728-Galle_Face_Hotel-Colombo_Western_Province.html",
,"0","966858148",,"es","2038179",,"Owner","967073421","en","2024-08-27","Mubarak Gaffoor","Dear Guest, 

Thank you for your feedback. We're pleased to hear you enjoyed our dedicated staff, breakfast offerings, and prime seaside location. We appreciate your observations on the building's condition and the noise from the terrace-restaurant. Rest assured, your comments will help us improve our guest experience. We hope to welcome you back for a more tranquil stay in the future.

Warm Regards,

Yohan Gunarathne 
Director Front Office
","2048","759521058","https://dynamic-media-cdn.tripadvisor.com/media/photo-o/2d/45/5f/22/caption.jpg","1536","2048","759521057","https://dynamic-media-cdn.tripadvisor.com/media/photo-o/2d/45/5f/21/caption.jpg","1536","2048","759521056","https://dynamic-media-cdn.tripadvisor.com/media/photo-o/2d/45/5f/20/caption.jpg","1536","1536","759521055","https://dynamic-media-cdn.tripadvisor.com/media/photo-o/2d/45/5f/1f/caption.jpg","2048",,,,,,,,,,,,,,,,,,,,,,,,,,,,,,,,,,,,,,,,,,,,,,,,,,,,,,,,,,,,,,,,,,,,,,,,,,,,,,,,,,,,,,,,,,,,,"3,2 Galle Road, Colombo 00300 Sri Lanka","Colombo","Sri Lanka","00300",,"3,2 Galle Road",,"2038179","6.920018","Colombo, Western Province","79.84597","Galle Face Hotel","4348","4.5","105","121","239","881","3002","https://www.tripadvisor.com/Hotel_Review-g293962-d2038179-Reviews-Galle_Face_Hotel-Colombo_Western_Province.html","http://www.gallefacehotel.com/","2024-08-26","MOBILE","3","Cuidado con las habitaciones con vistas al mar, son muy ruidosas. Llevar adaptador de corriente, aunque el hotel los suministra sin problema",,,,,,,,,,,,,,,"El hotel es un clásico de la ciudad, donde se hospedaban las celebridades en el siglo XX. Supongo que en XXI hay opciones mejores. El edificio conserva la espectacularidad de antaño, pero está muy mal conservado: pintura desconchada, aspecto viejo… Es una pena, porque su ubicación al borde del mar es perfecta. En la parte positiva: un personal entregado y competente y un desayuno magnífico, con oferta local e internacional. Hay una terraza-restaurante instalada en una de las fachadas, con música alta hasta medianoche. El problema es que las habitaciones con vistas al mar dan a ella, de manera que quienes busquen tranquilidad deben pedir expresamente habitación que de al otro lado. El hotel está situado cerca de un montón de restaurantes, tiendas y de un centro comercial enorme para el que le vaya ese rollo.","Para no exigentes","2024-08","FRIENDS","https://www.tripadvisor.com/ShowUserReviews-g293962-d2038179-r966858148-Galle_Face_Hotel-Colombo_Western_Province.html",
,"0","1007851301",,"en","480276",,"Owner","1008497393","en","2025-05-20","CRM Hayleys Leisure","Dear rak7861,

Thank you for sharing your honest feedback with us. We are sorry to hear that your experience, particularly with the food, did not meet your expectations. We always strive to cater to the diverse tastes of all our guests, including our valued Indian visitors, and we will certainly review your comments with our culinary team to improve our offerings.

Regarding the bottled water charges, we appreciate your feedback and will review our policies to ensure they are clear and fair for all guests.

Your comments are important to us as they help us enhance our services, and we hope to have the opportunity to welcome you back in the future to provide a better experience.

Warm regards,
Team Amaya Hills",,,,,,,,,,,,,,,,,,,,,,,,,,,,,,,,,,,,,,,,,,,,,,,,,,,,,,,,,,,,,,,,,,,,,,,,,,,,,,,,,,,,,,,,,,,,,,,,,,,,,,,,,,,,,"Heerassagala, Kandy 20000 Sri Lanka","Heerassagala","Sri Lanka","20000",,,,"480276","7.25913","Heerassagala, Kandy, Kandy District, Central Province","80.61932","Amaya Hills Kandy","4117","4.3","103","129","468","1244","2173","https://www.tripadvisor.com/Hotel_Review-g12220047-d480276-Reviews-Amaya_Hills_Kandy-Heerassagala_Kandy_Kandy_District_Central_Province.html","https://staahmax.staah.net/be/indexpackdetail?display=&groupId=MjA5Ng%3D%3D&display=firm&submit=Search&m_currency=LKR&propertyId=MjA3Nw==&promoCode=AMAYA24&_","2025-05-16","MOBILE","3","Indian don’t come here specially vegetarian.",,,,,,,,,,,,,,,"The property is average and not worth visit second time. They even charge for extra bottles of  water in room . I have been 15 days in Sri Lanka and changed 8-9 hotels nobody ask money for water bottles. What’s special about them that they charge for it. 

Food taste for Indians is not good. Indian vegetarian was there but no good taste . Only dosa was one good dish to eat and that saved us from being hungry. Nobody interested in asking whether food was good or bad. They really don’t care for it. Vegetarian Desserts were horrible.  Overall I think Indians should avoid this hotel. Breakfast have no milk shakes . Had bread and butter in breakfast . 

They have more liking towards Other European and Americans menu. And taste","Not recommended For Indians. The food is not of good taste and even the desserts were very. Bad in taste.","2025-05","FAMILY","https://www.tripadvisor.com/ShowUserReviews-g12220047-d480276-r1007851301-Amaya_Hills_Kandy-Heerassagala_Kandy_Kandy_District_Central_Province.html",
,"1","1006763779",,"en","480276",,"Owner","1007508264","en","2025-05-13","CRM Hayleys Leisure","Dear Design C,

Thank you for your kind words and for taking the time to share your experience. We're thrilled to hear that you enjoyed the lovely atmosphere, fantastic location, and felt at home during your stay. We truly appreciate your recognition of our staff, especially the assistant waiter.

However, we noticed your overall rating of 3/5 and would love to understand more about what we could improve. If possible, please feel free to contact us at 0114 767 888 so we can better understand your experience and ensure that we can make any necessary improvements.

We look forward to welcoming you back and providing an even better experience next time.

Best regards,
Team Amaya Hills","975","802482745","https://dynamic-media-cdn.tripadvisor.com/media/photo-o/2f/d4/ea/39/caption.jpg","1300","945","802482741","https://dynamic-media-cdn.tripadvisor.com/media/photo-o/2f/d4/ea/35/caption.jpg","1260","975","802482740","https://dynamic-media-cdn.tripadvisor.com/media/photo-o/2f/d4/ea/34/caption.jpg","1300",,,,,,,,,,,,,,,,,,,,,,,,,,,,,,,,,,,,,,,,,,,,,,,,,,,,,,,,,,,,,,,,,,,,,,,,,,,,,,,,,,,,,,,,,,,,,,,,,"Heerassagala, Kandy 20000 Sri Lanka","Heerassagala","Sri Lanka","20000",,,,"480276","7.25913","Heerassagala, Kandy, Kandy District, Central Province","80.61932","Amaya Hills Kandy","4117","4.3","103","129","468","1244","2173","https://www.tripadvisor.com/Hotel_Review-g12220047-d480276-Reviews-Amaya_Hills_Kandy-Heerassagala_Kandy_Kandy_District_Central_Province.html","https://staahmax.staah.net/be/indexpackdetail?display=&groupId=MjA5Ng%3D%3D&display=firm&submit=Search&m_currency=LKR&propertyId=MjA3Nw==&promoCode=AMAYA24&_","2025-05-10","MOBILE","3",,,,,,,,,,,,,,,,"This place has such a lovely atmosphere; the location is fantastic and truly feels like home. Thank you all for everything. I want to express my sincere appreciation for all the hard work from the staff, particularly the assistant waiter Supun, Janidu, and Commi Chef Supun Dilhara, as well as Tranee Chef Minodi.  Wishing you the best of luck!","Love and Nature","2025-05","COUPLES","https://www.tripadvisor.com/ShowUserReviews-g12220047-d480276-r1006763779-Amaya_Hills_Kandy-Heerassagala_Kandy_Kandy_District_Central_Province.html",
,"0","1005251968",,"en","480276",,"Owner","1005450938","en","2025-05-01","CRM Hayleys Leisure","Dear dineek2025,

Thank you for your valuable feedback. While we’re glad to hear that Ms. Renuka and Dr. Nirmani provided attentive service, we’re truly sorry the spa environment did not meet your expectations.

We appreciate your honest comments and will certainly look into improving the comfort and ambience to match the standards we strive for. Please contact us at 0114 767 888 so we can better understand your experience and ensure your next visit is more enjoyable.

Warm regards,
Team Amaya Hills",,,,,,,,,,,,,,,,,,,,,,,,,,,,,,,,,,,,,,,,,,,,,,,,,,,,,,,,,,,,,,,,,,,,,,,,,,,,,,,,,,,,,,,,,,,,,,,,,,,,,,,,,,,,,"Heerassagala, Kandy 20000 Sri Lanka","Heerassagala","Sri Lanka","20000",,,,"480276","7.25913","Heerassagala, Kandy, Kandy District, Central Province","80.61932","Amaya Hills Kandy","4117","4.3","103","129","468","1244","2173","https://www.tripadvisor.com/Hotel_Review-g12220047-d480276-Reviews-Amaya_Hills_Kandy-Heerassagala_Kandy_Kandy_District_Central_Province.html","https://staahmax.staah.net/be/indexpackdetail?display=&groupId=MjA5Ng%3D%3D&display=firm&submit=Search&m_currency=LKR&propertyId=MjA3Nw==&promoCode=AMAYA24&_","2025-04-30","OTHER","3",,,,,,,,,,,,,,,,"I visited the ayurvedic spa today for a foot reflexology treatment session for me and my husband. 
While the masseuse Renuka was very professional and did her best, sadly the setting of the massage room was not very relaxing or at least welcoming. 

While the previous occasions I stayed at the hotel (not the spa, this was my first time) was super great, this was a bit dissapointing. From Amaya Hills we expected better. 

To start with the massage room was really small and had hardly any space to move freely. The air was not so great to breathe, and i expected it to be aromatic or at least calming. I wasn't offered a robe and was seated on an arm chair, which wasn't comfortable at all.

While I got the relaxation through the massage, I developed a back pain by sitting in that ergonomically dead wrong chair.

Anyway the masseuse Renuka did her job well. Apart from that the only plus thing I saw about the whole thing was the prompt and flexible communication of Dr. Nirmani.

In a nutshell, the hotel management best attend improving the quality of the environment to be suited for a 4 star hotel spa.","The environment and the amenities in the massage rooms at the Amaya Hills spa could really use more improvement","2025-04","COUPLES","https://www.tripadvisor.com/ShowUserReviews-g12220047-d480276-r1005251968-Amaya_Hills_Kandy-Heerassagala_Kandy_Kandy_District_Central_Province.html",
,"0","1002347447",,"en","480276",,"Owner","1002988206","en","2025-04-16","CRM Hayleys Leisure","Dear Reh2372,

Thank you for sharing your feedback. We're glad you enjoyed the breathtaking views. We appreciate your comments regarding the food and will certainly take them into consideration as we work to improve our offerings. We hope to welcome you again in the future.

Warm regards,
Team Amaya Hills",,,,,,,,,,,,,,,,,,,,,,,,,,,,,,,,,,,,,,,,,,,,,,,,,,,,,,,,,,,,,,,,,,,,,,,,,,,,,,,,,,,,,,,,,,,,,,,,,,,,,,,,,,,,,"Heerassagala, Kandy 20000 Sri Lanka","Heerassagala","Sri Lanka","20000",,,,"480276","7.25913","Heerassagala, Kandy, Kandy District, Central Province","80.61932","Amaya Hills Kandy","4117","4.3","103","129","468","1244","2173","https://www.tripadvisor.com/Hotel_Review-g12220047-d480276-Reviews-Amaya_Hills_Kandy-Heerassagala_Kandy_Kandy_District_Central_Province.html","https://staahmax.staah.net/be/indexpackdetail?display=&groupId=MjA5Ng%3D%3D&display=firm&submit=Search&m_currency=LKR&propertyId=MjA3Nw==&promoCode=AMAYA24&_","2025-04-14","OTHER","3",,"Value","3","Location","5","Cleanliness","3","Service","5",,,,,,,"The hotel itself is good, a bit dilapidated and requires a renovation in my opinion. The  views are breathtaking. We had food at the bar. It was dreadful! Chicken wings were tasteless and the fries not crispy it was soggy. I hope this review will help with their plan to improve for the future.","Very average and needs improvement","2025-04","FAMILY","https://www.tripadvisor.com/ShowUserReviews-g12220047-d480276-r1002347447-Amaya_Hills_Kandy-Heerassagala_Kandy_Kandy_District_Central_Province.html",
,"0","999793251",,"en","480276",,"Owner","1000085170","en","2025-03-27","CRM Hayleys Leisure","Dear stephlaw,

Thank you for sharing your feedback. We’re glad to hear you enjoyed the amazing view. However, we regret that your experience with the room and service did not meet your expectations. We appreciate your comments and will certainly work on improving these aspects for future guests. We hope to have the opportunity to welcome you again.

Warm regards,
Team Amaya Hills",,,,,,,,,,,,,,,,,,,,,,,,,,,,,,,,,,,,,,,,,,,,,,,,,,,,,,,,,,,,,,,,,,,,,,,,,,,,,,,,,,,,,,,,,,,,,,,,,,,,,,,,,,,,,"Heerassagala, Kandy 20000 Sri Lanka","Heerassagala","Sri Lanka","20000",,,,"480276","7.25913","Heerassagala, Kandy, Kandy District, Central Province","80.61932","Amaya Hills Kandy","4117","4.3","103","129","468","1244","2173","https://www.tripadvisor.com/Hotel_Review-g12220047-d480276-Reviews-Amaya_Hills_Kandy-Heerassagala_Kandy_Kandy_District_Central_Province.html","https://staahmax.staah.net/be/indexpackdetail?display=&groupId=MjA5Ng%3D%3D&display=firm&submit=Search&m_currency=LKR&propertyId=MjA3Nw==&promoCode=AMAYA24&_","2025-03-25","MOBILE","3",,,,,,,,,,,,,,,,"Average hotel, rooms very dark and quite small. Amazing view but we didn’t find the staff very friendly or helpful. Food was ok but nothing exceptional. Probably wouldn’t choose to stay here again. Only there one night but definitely the poorest hotel we stayed at in Sri Lanka","Average","2025-03","COUPLES","https://www.tripadvisor.com/ShowUserReviews-g12220047-d480276-r999793251-Amaya_Hills_Kandy-Heerassagala_Kandy_Kandy_District_Central_Province.html",
,"0","992390067",,"en","480276",,"Owner","992570657","en","2025-02-07","CRM Hayleys Leisure","Dear Elaine G,

Thank you for sharing your feedback, and we sincerely apologize for the challenges you faced during your visit. We're so pleased to hear that you appreciated the stunning hotel, romantic location, bed linen, and our restaurant. However, we understand the frustration you experienced with the pool and accessibility issues. Your comfort and safety are our top priorities, and we truly regret that we did not meet your expectations in this regard.

We will be sure to address the concerns regarding accessibility and ensure that our guests with mobility challenges have the necessary assistance and facilities available to them. We truly hope your remaining days with us can be more comfortable, and we are here to help with any additional support or arrangements you may need.

Warm regards,
Team Amaya Hills ","1280","784727008","https://dynamic-media-cdn.tripadvisor.com/media/photo-o/2e/c5/fb/e0/caption.jpg","964","1280","784727009","https://dynamic-media-cdn.tripadvisor.com/media/photo-o/2e/c5/fb/e1/caption.jpg","964","1280","784727010","https://dynamic-media-cdn.tripadvisor.com/media/photo-o/2e/c5/fb/e2/caption.jpg","964","1280","784727011","https://dynamic-media-cdn.tripadvisor.com/media/photo-o/2e/c5/fb/e3/caption.jpg","964",,,,,,,,,,,,,,,,,,,,,,,,,,,,,,,,,,,,,,,,,,,,,,,,,,,,,,,,,,,,,,,,,,,,,,,,,,,,,,,,,,,,,,,,,,,,,"Heerassagala, Kandy 20000 Sri Lanka","Heerassagala","Sri Lanka","20000",,,,"480276","7.25913","Heerassagala, Kandy, Kandy District, Central Province","80.61932","Amaya Hills Kandy","4117","4.3","103","129","468","1244","2173","https://www.tripadvisor.com/Hotel_Review-g12220047-d480276-Reviews-Amaya_Hills_Kandy-Heerassagala_Kandy_Kandy_District_Central_Province.html","https://staahmax.staah.net/be/indexpackdetail?display=&groupId=MjA5Ng%3D%3D&display=firm&submit=Search&m_currency=LKR&propertyId=MjA3Nw==&promoCode=AMAYA24&_","2025-02-06","MOBILE","3","Positives are food, location and luxury. Negatives are pool accessablity, steep steps, scary roads up the hill
",,,,,,,,,,,,,,,"A scary trip. The driver circled the lake 4 times and was constantly on his mobile phone while dodging traffic, dogs, tuk tuks and buses. We left Wattala prior to 10am but didn't arrive until 4.15pm.
The hotel is stunning, reception and location romantic, bed linen housekeeping amazing.  Restaurant the best I experienced. Views are incredible. However...today I attempted to visit the pool. Elderly, disabled with difficulty walking couldn't find a dry towel, couldn't find an attendant, eventually offered a lounge along the deep end. Involving wiggling past the deep end.  I rely on my arms to lower myself.  Where's the shallow end entry? On the far side meaning wiggle past the deep end again at entry and exit. I gave up. Another 13 days Im stuck here , basically in my room as all walks around here are steep steps without rails.  🥹","Gilded prison","2025-02","SOLO","https://www.tripadvisor.com/ShowUserReviews-g12220047-d480276-r992390067-Amaya_Hills_Kandy-Heerassagala_Kandy_Kandy_District_Central_Province.html",
