,"0","954810945",,"en","14916776",,,,,,,,,,,,,,,,,,,,,,,,,,,,,,,,,,,,,,,,,,,,,,,,,,,,,,,,,,,,,,,,,,,,,,,,,,,,,,,,,,,,,,,,,,,,,,,,,,,,,,,,,,,,,,,,,,,,"NO 40 Middle Street Fort, Galle 80000 Sri Lanka","Galle","Sri Lanka","80000",,"NO 40 Middle Street","Fort","14916776","6.028811","Galle, Galle District, Southern Province","80.215515","Yara Galle Fort","333","4.8","4","2","5","37","285","https://www.tripadvisor.com/Hotel_Review-g297896-d14916776-Reviews-Yara_Galle_Fort-Galle_Galle_District_Southern_Province.html","https://yarahotels.lk/","2024-06-12","MOBILE","3",,,,,,,,,,,,,,,,"Lovely little hotel, we did move room as air con in original did not work well. All fine after move, in fact bathroom even better.
Did not eat here in evening however breakfast was really good Sri Lankan option.
Very peaceful and quiet and easy walking to the town bars and shops.","Lovely little hotel","2024-06","COUPLES","https://www.tripadvisor.com/ShowUserReviews-g297896-d14916776-r954810945-Yara_Galle_Fort-Galle_Galle_District_Southern_Province.html",
,"0","944328042",,"en","14916776",,,,,,,,,,,,,,,,,,,,,,,,,,,,,,,,,,,,,,,,,,,,,,,,,,,,,,,,,,,,,,,,,,,,,,,,,,,,,,,,,,,,,,,,,,,,,,,,,,,,,,,,,,,,,,,,,,,,"NO 40 Middle Street Fort, Galle 80000 Sri Lanka","Galle","Sri Lanka","80000",,"NO 40 Middle Street","Fort","14916776","6.028811","Galle, Galle District, Southern Province","80.215515","Yara Galle Fort","333","4.8","4","2","5","37","285","https://www.tripadvisor.com/Hotel_Review-g297896-d14916776-Reviews-Yara_Galle_Fort-Galle_Galle_District_Southern_Province.html","https://yarahotels.lk/","2024-03-28","OTHER","3",,"Value","5","Rooms","3","Location","5","Cleanliness","5","Service","5","Sleep Quality","3",,,"Beautifully appointed hotel and warm friendly staff. I enjoyed the breakfast style and the real coffee!
The air-conditioner was very noisy and there seems to be no option to turn off its light.
It would be good if the staff explained the use of the hot water system, as we had cold showers! A hair-dryer would be good too.","Beautifully appointed, comfy bed","2024-03","COUPLES","https://www.tripadvisor.com/ShowUserReviews-g297896-d14916776-r944328042-Yara_Galle_Fort-Galle_Galle_District_Southern_Province.html",
,"1","873327220",,"en","14916776",,"General Manager","875745009","en","2023-01-20","Lakkhana Kalawana","Dear Manchurian ,

Thank you very much for your valuable feedback and we are glad you loved our property.
We apologize for the inconvenience caused from our end. We have already taken necessary actions internally to ensure this won't happen again.
We wanted to arrange breakfast for you from a restaurant on your way, however, the driver has informed us that you have refused to take it. 
However, we were glad that you liked the complementary seafood lunch we have offered to you. 

Please visit us once again if you are in and around the Galle Fort, we'd be happy to serve you better next time. 
Thank you
Lakkhana Kalawana - General Manager",,,,,,,,,,,,,,,,,,,,,,,,,,,,,,,,,,,,,,,,,,,,,,,,,,,,,,,,,,,,,,,,,,,,,,,,,,,,,,,,,,,,,,,,,,,,,,,,,,,,,,,,,,,,,"NO 40 Middle Street Fort, Galle 80000 Sri Lanka","Galle","Sri Lanka","80000",,"NO 40 Middle Street","Fort","14916776","6.028811","Galle, Galle District, Southern Province","80.215515","Yara Galle Fort","333","4.8","4","2","5","37","285","https://www.tripadvisor.com/Hotel_Review-g297896-d14916776-Reviews-Yara_Galle_Fort-Galle_Galle_District_Southern_Province.html","https://yarahotels.lk/","2022-12-30","OTHER","3","Opt for a room on the first floor. In the lower floor one is disturbed with loud food steps from the floor above.","Value","5","Location","5","Service","3",,,,,,,,,"Well located in the Galle Fort & beautifully decorated in shades of blue & white Yara is an ideal stay in the Galle, but the property management is a bit lax.
 1) We were greeted with a used diaper in our bathroom bin, not cleaned after the previous guests. 
2) On check in we had clearly mentioned that we will be leaving early for whale watching the next morning & would need an early, packed breakfast. The reception staff made a note of it too. But to our surprise there was no one at the reception the next morning. We got to know the staff was still sleeping and we had to leave without our breakfast. The staff profusely apologised for the mistake later and made up for it with a good lunch but the overall experience left us a bit disappointed, forcing me to give a 3 star rating where I would have loved to give a 5.","Beautiful property, not so great","2022-12","FRIENDS","https://www.tripadvisor.com/ShowUserReviews-g297896-d14916776-r873327220-Yara_Galle_Fort-Galle_Galle_District_Southern_Province.html",
,"1","718594908",,"en","14916776",,"General Manager","720927104","en","2019-10-24","Yara-Galle-Fort","Dear Peter H,

First of all I would like to thank you for your detail review on your one night stay with us. Kindly note my comments below;
Google Earth - 1st and the last google street view shoot was done back in March 2016. Hence we have to wait google to update it as we cannot update it locally from our end.
Reception – Regarding the issue during the booking that you encountered, I would like to point out that the $50 charge is not an additional charge but to the second person per night. Had you gone ahead with the booking for a double room initially on your email we would���ve quoted the same amount of $50 per person. Also, Having an additional guest in a room will cost us in many ways such as water, amenities and linen consumption is double than a single occupancy and Air Condition burns extra electricity to cool down a room with double occupancy than a room with a single occupancy.
Bathroom – We are glad to inform you that we have already installed a shelf in shower are a to keep your shampoo, shower gel etc. this was brought to our attention by our guests however it took little time than expected as we couldn’t find the right quality before. 
Amenities including Entertainment – We have 4 movie channels, 5 Sports channels, 13 Variety channels in 6 different languages, 5 Travel / Living channels, news channels and kids channels. We have more than 25 International channels and 6 Sri Lankan TV channels. Hence we are unable to understand what you meant by ‘basic Channels’
Food Offering- We regret that we were not able to exceed your expectation. However our breakfast was a hit on many guest reviews.
Security - We would like to put on note that the hotel is under CCTV surveillance 
Value for Money – You were allocated Room no 103 one of our best Superior rooms. We fail to understand what made you to call it Inferior room.

We hope you will give us another opportunity to serve you at Yara Galle Fort.

Thank You. 
",,,,,,,,,,,,,,,,,,,,,,,,,,,,,,,,,,,,,,,,,,,,,,,,,,,,,,,,,,,,,,,,,,,,,,,,,,,,,,,,,,,,,,,,,,,,,,,,,,,,,,,,,,,,,"NO 40 Middle Street Fort, Galle 80000 Sri Lanka","Galle","Sri Lanka","80000",,"NO 40 Middle Street","Fort","14916776","6.028811","Galle, Galle District, Southern Province","80.215515","Yara Galle Fort","333","4.8","4","2","5","37","285","https://www.tripadvisor.com/Hotel_Review-g297896-d14916776-Reviews-Yara_Galle_Fort-Galle_Galle_District_Southern_Province.html","https://yarahotels.lk/","2019-10-15","OTHER","3","Avoid rooms with direct access to the courtyard","Value","2","Rooms","3","Service","3",,,,,,,,,"Location and Access – The hotel within the walls of Galle Fort and within easy walking distance of the historical centre and the ramparts. Close by are shops, banks, restaurants and bars

Google Earth – The un renovated hotel can be seen on Street View

Architectural Style – Low rise characterful recently renovated Colonial building

Reception – I had experienced some difficulty with my booking.com reservation but reception had responded speedily to email enquiries prior to my arrival. However, my original booking had been for one person but due to a change in circumstances check in was to be for 2. This resulted in an additional surcharge of $50 which I considered quite expensive bearing in mind the only additional expense the hotel would have was an extra towel and a breakfast

Public Areas/Decor – In the entrance a small restaurant /bar with tables also outside on the roadside garden. Internally a garden courtyard with seating area. Décor fresh with antique objet

Guest Rooms – Several types of room advertised on booking websites. Not sure I was allocated the one I actually booked. This was adjacent to the reception area and proved to be quite noisy

Decor/Maintenance/Cleanliness – Everything was fairly new and in reasonable condition

Furnishing/Bed –king size bed with side tables, wardrobe and work top/dressing table

Bathroom – Well appointed with good quality fixtures and fittings. Walk in shower. Reasonable powerful hot water. Ample towels and complimentary toiletries. However, lacking attention to detail no shelf in shower area for soap, shampoo etc.

Space – Adequate

Amenities including Entertainment – TV with basic Channels, Wi-Fi, tea and coffee making, complimentary water, mini fridge. Plenty of electrical sockets capable of charging personal devices

Lighting – Not a lot of natural light. Bedroom faced onto the courtyard corridor and for privacy it was necessary to have the blinds closed most of the time. Artificial lighting was reasonable

Air Conditioning – Effective

Noise – Some disturbance from other guests in corridor/courtyard outside room and at reception

Food Offering – The breakfast was standard

Security – In room safe

Value for Money – The additional supplement charged for an extra guest and the fact I believed that I had been allocated an inferior room left me with the feeling that I had not received good value for money 

X Factor – The location within the historical Galle Fort is a plus point for the hotel","Location in Historic Centre","2019-10","NONE","https://www.tripadvisor.com/ShowUserReviews-g297896-d14916776-r718594908-Yara_Galle_Fort-Galle_Galle_District_Southern_Province.html",
,"0","1015526569",,"fr","496623",,"Owner","1015731116","en","2025-06-29","Aitken Spence  Hotel Management","Dear Valued Guest,

Thank you for taking the time to share your feedback.
We’re pleased to hear you enjoyed our helpful staff, excellent food, and well-maintained facilities. However, we sincerely apologize for the inconvenience caused by the billing issue you experienced. This is certainly not the standard of service we strive to provide.

Please allow us the opportunity to investigate this matter further and resolve it promptly. 

Thank you again for your valuable feedback and for recommending our chain despite this unfortunate incident. We hope to restore your trust and welcome you back for a flawless experience.

Warm regards,
Warm regards,
Purnima Weerasinghe,
Front Office Manager,
",,,,,,,,,,,,,,,,,,,,,,,,,,,,,,,,,,,,,,,,,,,,,,,,,,,,,,,,,,,,,,,,,,,,,,,,,,,,,,,,,,,,,,,,,,,,,,,,,,,,,,,,,,,,,"Galle Road, Ahungalla 80562 Sri Lanka","Ahungalla","Sri Lanka","80562",,"Galle Road","","496623","6.311592","Ahungalla, Galle District, Southern Province","80.0318","Heritance Ahungalla","5167","4.6","96","90","317","893","3771","https://www.tripadvisor.com/Hotel_Review-g608521-d496623-Reviews-Heritance_Ahungalla-Ahungalla_Galle_District_Southern_Province.html","http://www.heritancehotels.com/ahungalla/","2025-06-28","OTHER","3",,"Value","4","Rooms","4","Location","4","Cleanliness","5","Service","5","Sleep Quality","5",,,"Très bel Hotel , personnel absolument  serviable , en demi pension , nous avons très bien mangé ,choix nourriture excellent,  l'hotel est propre , bien entretenu , mais j'invite les clients à faire attention lors du règlement de la facture  concernant  les boissons , snacks et autres car on m'a débité le montant total 2 fois en me disant que la transaction  n'est pas passée , en me donnant un seul ticket   Depuis , j'ai envoyé une trentaine de mails à leurs adresses valides et je n'ai jamais eu la moindre réponse ,  l'Hotel reste muet à toutes mes demandes  , ce  que je trouve innacceptable d'un hotel de cette catégorie , voilà pour ma mésaventure de l'Heritance  qui est pourtant une chaine recommandable","arnaque sur la facture des extras","2025-03","COUPLES","https://www.tripadvisor.com/ShowUserReviews-g608521-d496623-r1015526569-Heritance_Ahungalla-Ahungalla_Galle_District_Southern_Province.html",
,"0","1014149379",,"en","496623",,"Owner","1015073314","en","2025-06-25","Aitken Spence  Hotel Management","Dear Amila,

Thank you for taking the time to share your experience with us.

We’re very pleased to hear that you enjoyed our food offerings—especially the seafood selection—and that you appreciated our pools and the helpfulness of our staff. It's always encouraging to know our efforts contribute to a relaxing stay.

We sincerely regret to hear about the discomfort you experienced with the spare bed in your triple room, as well as the inconvenience caused by the power interruptions. Please accept our apologies for the impact this had on your rest. Your feedback is valuable and has been shared with the relevant teams to ensure these concerns are addressed and improvements made.

We’re grateful for your balanced review and hope to have the opportunity to provide you with a fully seamless experience on your next visit to Heritance Ahungalla.

Warm regards,
Purnima Weerasinghe,
Front Office Manager,
Heritance Ahungalla.
",,,,,,,,,,,,,,,,,,,,,,,,,,,,,,,,,,,,,,,,,,,,,,,,,,,,,,,,,,,,,,,,,,,,,,,,,,,,,,,,,,,,,,,,,,,,,,,,,,,,,,,,,,,,,"Galle Road, Ahungalla 80562 Sri Lanka","Ahungalla","Sri Lanka","80562",,"Galle Road","","496623","6.311592","Ahungalla, Galle District, Southern Province","80.0318","Heritance Ahungalla","5167","4.6","96","90","317","893","3771","https://www.tripadvisor.com/Hotel_Review-g608521-d496623-Reviews-Heritance_Ahungalla-Ahungalla_Galle_District_Southern_Province.html","http://www.heritancehotels.com/ahungalla/","2025-06-21","OTHER","3",,"Value","4","Rooms","1","Location","5","Cleanliness","5","Service","5","Sleep Quality","1",,,"Overall experience was good. Food was amazing, great seafood selection for dinner and wonderful pools. Staff was very helpful.
On cons; stayed in a triple bed room, however the spare bed was very uncomfortable. I have been in many stars hotels and the spare bed were always top notch, quite disappointed considering hertiance.
There was multiple power cuts trough out the night, so had to constantly call the reception, not the best night sleep with combined with the bad bed.
Other than that, pretty much a nice relaxed stay.","Great Holiday with minor issues","2025-06","FAMILY","https://www.tripadvisor.com/ShowUserReviews-g608521-d496623-r1014149379-Heritance_Ahungalla-Ahungalla_Galle_District_Southern_Province.html",
,"0","1007687540",,"en","496623",,"Owner","1007959094","en","2025-05-17","Aitken Spence  Hotel Management","Dear Valued Guest,

Thank you very much for taking the time to share your detailed feedback following your recent stay at Heritance Ahungalla.

We are truly grateful for your kind words about our team. It brings us great joy to hear that our staff – from the Guest Experience Officer to our bartenders, cooks, lifeguards, and security – contributed so positively to your stay. A special thank you for mentioning Captain Nelka, Captain Kalinga, Jogatia, and Thamsha from the pool bar. We will be sure to pass along your compliments to them – they will be delighted to know they made a meaningful impact.

We’re pleased that you appreciated our beachfront location, tropical surroundings, and distinctive architecture, as well as the overall ambiance of your room.

We also sincerely thank you for your honest and constructive observations regarding areas where we can improve. We understand your concerns about the room lighting design, the occasional presence of insects during the rainy season, and the organization of entertainment and activities. Your feedback regarding food quality and variety is also noted and will be shared with our culinary team for review.

At Heritance Ahungalla, we constantly strive to elevate the guest experience, and your insights are invaluable in helping us do so. While we are glad that you found value in our location, beach, pool, and – most importantly – our people, we also recognize the areas you feel fell short of your expectations. Please rest assured that your comments will be carefully reviewed with the relevant departments to ensure improvements are made.

Thank you once again for choosing to stay with us and for sharing your honest reflections. We hope to have the opportunity to welcome you back for a more enhanced experience in the future.

Warm regards,
Purnima Weerasinghe,
Front Office Manager,
Heritance Ahungalla.
","2268","803190345","https://dynamic-media-cdn.tripadvisor.com/media/photo-o/2f/df/b6/49/caption.jpg","4032","2268","803190418","https://dynamic-media-cdn.tripadvisor.com/media/photo-o/2f/df/b6/92/caption.jpg","4032","3024","803190607","https://dynamic-media-cdn.tripadvisor.com/media/photo-o/2f/df/b7/4f/caption.jpg","4032",,,,,,,,,,,,,,,,,,,,,,,,,,,,,,,,,,,,,,,,,,,,,,,,,,,,,,,,,,,,,,,,,,,,,,,,,,,,,,,,,,,,,,,,,,,,,,,,,"Galle Road, Ahungalla 80562 Sri Lanka","Ahungalla","Sri Lanka","80562",,"Galle Road","","496623","6.311592","Ahungalla, Galle District, Southern Province","80.0318","Heritance Ahungalla","5167","4.6","96","90","317","893","3771","https://www.tripadvisor.com/Hotel_Review-g608521-d496623-Reviews-Heritance_Ahungalla-Ahungalla_Galle_District_Southern_Province.html","http://www.heritancehotels.com/ahungalla/","2025-05-15","OTHER","3","If you want to tip anybody, better start with 500 Rs per tip.","Value","3","Rooms","3","Location","4","Cleanliness","5","Service","5","Sleep Quality","4",,,"Let's start with the best part of our experience - super friendly staff. We had lots of nice interactions with everyone starting from the Guest Experience Officer lady, through bartenders and cooks, finishing on life guards and security. We want to emphasize work of guys from pool bar (and probably misspell their names :) ) - captain Nelka, captain Kalinga, barman Jogatia and Thamsha. Unquestionably staff is the strongest point of that hotel.
Hotel is located next to the wonderful sand beach with tropical flora and fauna. It doesn't look like another boring hotel from Turkey, Spain or Greece. Its architecture is something refreshing and memorable.
Rooms also look very pleasant and not cheap. However the first problems appear there. It takes time to understand how light switches are organized and there is no main light source on the ceiling. Instead we got a big fan which was pointless with working air conditioning. Also if you are scared of insects better be prepared to meet some in the bathroom after rains. Hotel staff proposed us change of the room but we chose just additional insect spraying. If you want to go to tropics, expect tropical animals. :)
Huge disadvantage of this hotel is lack of any activities. Live band performances were the only thing happening there. We saw an animator maybe once when they were flying kites with kids. The animation plan in the hallway had nothing to do with reality. If you want to only sunbath, swim and chill it could be the advantage but it is not what is being sold here.
Food was mostly good but there was also some inedible foods. South Asian cuisine itself is very tasty and you will be able to experience that here. However some pork was impossible to bite and chicken almost always contained little bones which can make you choke to death.
Overall this hotel is nice but it is not a five star experience. It was just like an average three star hotel in Europe but located in more exotic location. Friendly staff is the biggest jewel in its crown. Next are beautiful beach and big main pool. Beside these three things Heritance Ahungalla doesn't offer anything memorable.

In the end it is important to mention locals selling trips and clothes next to the hotel. You will always encounter them when going to the beach or even walking next to the fence. They are very friendly but remember that every interaction is meant to sell you more stuff with relatively high price. But if you negotiate prices and stay assertive, you can have a great experience for relatively low cost.","The best average hotel","2025-05","COUPLES","https://www.tripadvisor.com/ShowUserReviews-g608521-d496623-r1007687540-Heritance_Ahungalla-Ahungalla_Galle_District_Southern_Province.html",
,"0","1001015611",,"en","496623",,"Owner","1001105565","en","2025-04-04","Aitken Spence  Hotel Management","Dear Valued Guest,
Thank you for your detailed and constructive feedback. We truly appreciate you taking the time to share your experience with us. We're glad to hear that you enjoyed the beautiful beach, tranquil pool, and our helpful guest relations executive, Jayaru. Your kind words about her will certainly be passed on.

We also value your suggestions for improvement, such as replacing the wooden sun beds, repainting certain areas, and offering more variety in room amenities and dining options. Please rest assured that we will be looking into these concerns to make the necessary improvements and ensure a more enjoyable experience for our future guests.

Thank you again for your helpful insights, and we hope to welcome you back soon for an even better stay.
Warm regards,
Priyan Wijerathne
Assistant Vice President / Cluster General Manager 
Heritance Ahungalla.
","4032","797258105","https://dynamic-media-cdn.tripadvisor.com/media/photo-o/2f/85/31/79/caption.jpg","3024","4032","797258106","https://dynamic-media-cdn.tripadvisor.com/media/photo-o/2f/85/31/7a/caption.jpg","3024","3024","797258107","https://dynamic-media-cdn.tripadvisor.com/media/photo-o/2f/85/31/7b/caption.jpg","4032","3024","797258108","https://dynamic-media-cdn.tripadvisor.com/media/photo-o/2f/85/31/7c/caption.jpg","4032","3024","797258109","https://dynamic-media-cdn.tripadvisor.com/media/photo-o/2f/85/31/7d/caption.jpg","4032","3024","797258110","https://dynamic-media-cdn.tripadvisor.com/media/photo-o/2f/85/31/7e/caption.jpg","4032","1200","797258111","https://dynamic-media-cdn.tripadvisor.com/media/photo-o/2f/85/31/7f/caption.jpg","1600","3024","797258112","https://dynamic-media-cdn.tripadvisor.com/media/photo-o/2f/85/31/80/caption.jpg","4032","4032","797258113","https://dynamic-media-cdn.tripadvisor.com/media/photo-o/2f/85/31/81/caption.jpg","3024","1600","797258114","https://dynamic-media-cdn.tripadvisor.com/media/photo-o/2f/85/31/82/caption.jpg","739","4032","797258115","https://dynamic-media-cdn.tripadvisor.com/media/photo-o/2f/85/31/83/caption.jpg","3024","4032","797258116","https://dynamic-media-cdn.tripadvisor.com/media/photo-o/2f/85/31/84/caption.jpg","3024",,,,,,,,,,,,,,,,,,,,,,,,,,,,,,,,,,,,,,,,,,,,,,,,,,,,,,,,,,,,,"Galle Road, Ahungalla 80562 Sri Lanka","Ahungalla","Sri Lanka","80562",,"Galle Road","","496623","6.311592","Ahungalla, Galle District, Southern Province","80.0318","Heritance Ahungalla","5167","4.6","96","90","317","893","3771","https://www.tripadvisor.com/Hotel_Review-g608521-d496623-Reviews-Heritance_Ahungalla-Ahungalla_Galle_District_Southern_Province.html","http://www.heritancehotels.com/ahungalla/","2025-04-04","OTHER","3","The hotel hosted several beach private parties for outside clients but luckily they usually finished quite early so the music stopped then. ","Value","4","Rooms","3","Location","4","Cleanliness","3","Service","4","Sleep Quality","4",,,"This hotel is situated on a beautiful beach and surrounded by nice gardens. It has two pools , one of which is much quieter than the other and where you can sit and enjoy the tranquility.  The wooden sun beds are showing a lot of wear and tear and would benefit from being replaced. 
However whilst the hotel is supposedly five star , it is definitely not a five star hotel. The entrance area is very nice but elsewhere the whole place would benefit from repainting  as there are a lot of scuffs and marks on the walls/floors upstairs. In our room the curtains had a lot of marks on them - the screens were broken and the bathroom had lots of marks on the walls and tiles. The tea and coffee in the room only offered English breakfast tea and caffeinated coffee. Decaf was not available anywhere in the hotel and only offering one type of tea where it’s grown we thought quite strange. The air conditioning in the room was very good. The plug sockets in the room looked dangerous and were hanging out of the wall but one plug was an international socket which was really helpful. The staff are mostly very nice and friendly, not so much the male waiting staff in the bar and restaurant. Speaking of the restaurant , the food offered was quite repetitive and in our opinion the quality of the meat in the dishes was not the best. The desserts were ok ! 
However , the one shining star of this hotel is Jayaru - the guest relations executive - she was absolutely delightful, a huge help with everything. We definitely could not have managed all the things we wanted to do without her. She arranged a private driver (Sampath) for us to take us to the elephant orphanage, Kandy and to a very interesting tea plantation at Pitigala. It was certainly a much nicer way to see these sights than with a dedicated tour bus ( the buses become quite uncomfortable after several hours of driving). Also it was cheaper to do it this way too. 
Sampath can be contacted via WhatsApp on +94 76 540 2575 for private trips.","Heritance hotel Ahungalla March/April 2025","2025-03","COUPLES","https://www.tripadvisor.com/ShowUserReviews-g608521-d496623-r1001015611-Heritance_Ahungalla-Ahungalla_Galle_District_Southern_Province.html",
